,review_id,user_id,business_id,stars,date,text,useful,funny,cool,contradictory,figurative,confusing,qualifier
4472047,Zgfp8EPKeC5XrUFzvotL_Q,orh0HRUNCWuQMt9Iia_osg,LGZPjmhEg2QYeGZ2PKnpQw,3,2015-07-05,"Definitely not cheap. Food's good quality though.
 
 Had:
 Squid tentacles - Ordered because Yelp said they were good. They were pretty good, but the larger pieces were a little bit chewy. Good flavor though.
 Curry cuttlefish - Cuttlefish were really tender. Curry flavor was good. Awkward how they put fries into the bottom though. Steamed cuttlefish = steamed fries. Defeats the purpose of fries. Also filler. Less cuttlefish if you put fries at the bottom of the dish.
 Spareribs with black bean sauce - Definitely better quality ribs than I'm used to at dim sum. Other than that, pretty similar. Taro chunks at the bottom. Also filler.
 Fois gras and mango deep fried rolls - Think standard shrimp salad rolls at dim sum, but with small bits of fois gras and strips of mango inside, and the salad dressing on of the roll. Five pieces? Something like that. Not enough fois gras. Salad dressing overwhelmed the entire thing. That being said, it was tasty. Not worth the price though.
 Snow pea shoot and fried tofu steamed rice noodle - for all you vegetarians out there, this one's delicious. It's an interesting combination, and the mouth feel is quite nice. Snow peas are fresh.
 Snow pea shoot steamed dumpling - Supposedly had scallop in it. I couldn't find any. That being said, the snow pea shoot filling was almost (or actually) entirely just that. It was really tasty.
 Lion head beef meatballs - Or just big beef meatballs. A tad more black pepper in these than I was expecting, but it was quite welcome. Meat was tender. Very much so. Not much beef flavor though.
 Deep fried taro shred with minced pork filling - Usually yum. This one was also yum. Taro shred was nice and loose (not dense and packed in. More like deep fried floss?) and the inside was moist. Good ratio of external taro and internal filling.
 Garoupa and bitter melon pan fried rice noodles? - I think that was the name of the fish...Fish was delicious. Bitter melon was a good kind of bitter. Pan fried rice noodles were done well. Good base. Sauce made it so it wasn't dry. Good portion for six people.
 Durian pastry - An odd green color. That being said, the inside is quite strong on the durian, and entirely delicious. Custard-like. The outside was flaky pastry and oh so delicious as well. Three pieces. A great way to end my meal.
 
 If the prices were better and the service was better, I'd make this one of my go-to dim sum places. Well, that and if it was closer to home...",5,0,0,1,1,0,1
1981237,Nk_riouqbWxDy7xase07wA,8959F5stCzJWI_I7dgxurg,kWvBsbALiMDOghpoBh-tAQ,4,2011-08-09,"I was very skeptical of this place because I am normally not a fan of strip center Mexican food places. This location isn't the newest and nicest but it is definitely a solid joint and far exceeded my expectations. 
 
 Our server\/waiter was fast, friendly and courteous. The chips and salsas brought to the table when you sit down were fresh and excellent. I especially loved loved loved the red one. I bought a pint to take home to put on EVERYTHING. There is just enough spice and great flavor. There is some secret ingredient but I can't place it. We also ordered the melted cheese thing for an appetizer and it was awesome cheesy goodness. Next time we are going to order it with green chilies. 
 
 My wife and I split the ""Fajitas for 2"" with 1\/2 chicken and 1\/2 steak. I thought it was excellent. The meat was tender and juicy and there were plenty of sauteed onions and peppers throughout. There was also more than enough for 2 people. The flour tortillas were also fresh and delicious. Their guacamole was less than stellar however.
 
 This is probably one of my favorite local Mexican places and I can't wait to go back.",1,1,0,0,1,0,0
4348752,Wtj_zW0_HbzuaO_Dkac0Fg,SJQ65xwHEckAe0dRzO7cbA,e4NQLZynhSmvwl38hC4m-A,3,2015-11-14,"Loved the place. Froze my ass off dining outside as the indoor seating is limited. Although the Carne Asada street tacos were great, too much onion was a little over bearing so I will leave them off next time. We will be going back in the future.",0,0,0,0,1,0,0
3128683,gltgt8OI22v2kjEKVO6WHw,6e_OSObAd1UkEDs_qXDgpg,DaTQLers4x_DbGPi7r_xVw,4,2014-05-22,"TIME is what you need when you come here. But it's worth it. Some may say the service brings new meaning to Lazy Mexicans -- but they are really just taking the time to make everything fresh! From the guacamole to the margarita, it's all done right before your eyes and it's worth the wait. The Tacos are good, and reasonably priced too. Just make sure you're not in a rush.",0,0,0,1,1,0,0
835647,ExH2gu65KslEKbKDpi3sig,yqa2qWN6acpmDuDL3U61UA,IMb5BpDLlSbr7yn19HhltA,3,2013-08-06,"Overall, not a bad dining experience... but nothing was exemplary about it either. I'll go back.
 
 I am fairly consistent with what I order when trying new places that are similar to other places that I have previously been to. What I mean by that is that unless something is highly recommended by other Yelpers, then I will typically get the steak tacos at a Mexican restaurant... and that way I can, in my own way, compare each restaurant to the others.
 
 Anyway, there was only a very brief wait to get seated... and the service was really attentive, coming back to check on our meal, and filling up our waters often (always a big plus in my book).",2,0,1,1,0,0,1
1957756,7JmYT-IznRr_gTM0DY6xCg,QRBOntXw8L4z3-RgZONFaw,7sh1qDlGo_80zpJfFrnb4Q,5,2015-03-07,"My wife and I ate here twice in last 10 days. 
 
 After 2 recent strikeouts in local Restuarants we've frequented for years, this was a great find. Don't know what took us so long. 
 
 Great selection of Italian food, incredible taste, served hot and timely, great proportions. Also great service and vino selection. 
 
 Met the owner Tues night. Day before their cooler had gone out and they lost all their food yet she and staffed worked all day to get ready to serve their guests any way. Many other places would have shut down for the night. 
 
 Somewhat limited hours but maybe that's why quality so high.",1,0,0,0,1,0,0
4374279,VDhD9b9L455mikkCmfhQSQ,KcBKiAErgC9mgOagGIoOqw,dAmVTQ6ukuLh4UxTmBoRkg,2,2016-06-12,"Food was only ok, not amazing!! Prices are decent. The latte was great!! 
 
 The wait was way too long....waited 40 minutes for the table for 2 and another 35 minutes for the food. This restaurant is very small, that is why the wait was long. The menu is small and few items, such as the popular dishes like Egyptian falafel and Grilled Cheese, were sold out by noon. After a 40 minutes wait to find out that the popular dishes were sold out...that was a big disappointment. I wondered why the waitress didn't tell us about this when she gave us the menu and only mentioned about the items are sold out when we place the ordered !! 
 After all, the Service was great..friendly staffs.
 
 In conclusion, i will not come back to this restaurant again. DEFINITELY NOT WORTH THE WAIT AS FOOD WAS NOT THAT GREAT!! NOTHING SPECIAL.",6,1,1,1,0,0,0
4021985,cpuim08I33vZLtdy-zQcSQ,1HFkcIGKY7-e9vCsc8PX5g,3glVZZh_vyZH1VvPU0307A,3,2010-10-14,"What a great place! My dining partner and I were both charmed by the ambiance, and we each took full advantage of their 2 oz. taster wines--it's such a great way to have a different wine with each course and still be able to go to work the next day.
 
 The food wasn't that impressive, though--I ordered a pasta dish that arrived oily and underseasoned, and my friend's chicken was similarly bland. We were very impressed with the post-prandial cheese selection, though, and the appetizer we shared was a lovely balance of salty (anchovies), sour (capers), and sweet (buffalo mozzarella). I'm glad there's a place like this in the neighbourhood, but I think I'll stick to drinks and appetizers here.",0,0,1,1,0,0,1
1754059,fSz4e51a066mmUvBj8sKTQ,11gxVnIOvxL5PI4Ur9qa2g,CauQnqZ5eowyrr7oWF_p3Q,2,2013-05-10,This review is for Road Kill Grill... The ribs were tasty enough but very dry & overcooked as was the brisket. The mac & cheese was forgettable just like the potato salad. The spicy BBQ sauce was the best part about the meal. I also do not like how you have to wait in the same damn room that they sell the butcher meat in which is already an extremely small place & the door is constantly bumping someone in the ass. This place is WAY OVERRATED. I have eaten from their truck before & for some reason it was better. The sad thing is that since that Guy Fieri said it was good on his Drive-Ins & Dives show every sheep in Las Vegas can't think with their own tastebuds... either that or BBQ has some really slim pickins in Sin City.,1,2,1,1,0,0,1
1284648,tvyd_pyICJjKUwEIBRzscQ,Y8Sl5rn2CFCI2KvGzCEWJw,cPaXllVOblQn3kHQ8olDsw,2,2016-02-27,The food was tolerable..friendly staff also. They delivered within 45 minutes as was told. Taste for pricing: I wasn't too pleased. For a 24 hour delivery I wouldn't expect too much more than what I did. One negative thing is that I specified wanting sweet and sour and teriyaki sauce and they forgot but that wasn't a deal breaker I just wasn't crazy for the taste. Paid about 40 dollars for two combo plates.,1,0,0,1,0,0,1
3560865,QTSQ-SfWFTltVxhVTq6peg,vb8EOWY1xjdCEmyETHBcVQ,KkmPDIWzvwbBpyqOHT6pcQ,3,2017-01-22,"Came here last night with my boyfriend and I have to say if I were basing my rating on the service alone it would be 5 stars. 
 
 We started with the calamari, baked clams, and meatballs. The meatballs were absolutely amazing! They were soft, moist, tender and very flavorful. The calamari was a little too greasy for me but again the sauce was seasoned perfectly. The baked clams were mostly breading and didn't have that crispness on top that you look for. 
 
 We then split the Caesar salad which was very good and had nice sheets on thin fresh Parmesan cheese. 
 
 For entrees I had the Ossobuco which I was disappointed with. It was a little tough and the risotto was bland. My boyfriend had the chicken Parmesan which he enjoyed. 
 
 For dessert the peanut butter tart was delicious! 
 
 All in all not a bad meal, but nothing compared to the original back in Harlem.",2,1,1,1,1,0,1
894342,ux5FMg4kpzxmJPWOe8vjuA,kYrVRyC2KMbM_NqdxlzuGw,jz4lgoy76EUsLvhcFYgHAw,1,2016-02-01,"Showed up one evening for food to go and there wasn't a single employee in the building. One finally came from the patio and took my order. I asked for extra tzatziki sauce for my gyro. I was given my food and checked to make sure my extra sauce made it in, there was no sauce at all. Again no employee anywhere... So I went into the kitchen and asked the chef for sauce to go. 
 
 Food was ok. Service was horrible.",0,0,0,1,1,0,0
1919601,N-nPUJyuDKr34nV21xfJ6A,XrD55Ms-Yy9bxIJD1MF5fQ,eTmy0-h4tTEpfbDVAue0MA,3,2015-03-18,"Crust, crust,crust was a bust.thin yes but no crunch to it. The cheese , sausage and sauce was very tastey. Had a antipasta salad..just ok at best.. If you are looking for a crispy crust not here..",0,0,0,1,0,0,0
4433018,cwR3vtqF8goEMZW_NAzcdQ,Rq_u4iMkUjznNdKoIvRT3A,IK1XaujWC-znIGaVE0tbBA,2,2017-05-30,Nothing fantastic about this place. This is where you go when you now absolutely nothing about vinyl and just bought your first crosley player from Best Buy hahaha,1,1,0,0,1,0,0
2269611,XpAhXaIULuZmWhDjq11k5g,tSHU6u1VszJTMUqkYIGxDw,xkVMIk_Vqh17f48ZQ_6b0w,1,2015-10-15,"Showed up early for our romantic anniversary dinner reservation on October 9th, expecting to have a cocktail to find the bar was packed. That's fine, we went next door to Hecho. Upon our return, we were seated at a tiny table for two, in the packed bar! When asked, ""Is there something more private for us? This is rather uncomfortable,"" the host responded with, ""Well, since you made your reservation today, this is what we have for you."" Ok, that's fine, we'll relax and make the best of it. A server quickly came by, asking for our order yet, we hadn't opened the wine list nor reviewed the menu yet. After deciding what we'd like to order, about 10mins later, we waited patiently for our server who never showed after another 15mins so we left. We walked over to L'Atelier thinking we had no chance of getting a seat yet alas, we were seated and had another FABULOUS evening! Thank You and we'll be back to support the Joel Robuchon again in a heartbeat. Sorry Tom Colicchio. Cheers!",1,0,0,1,1,0,0
3080822,7h74g6e1zhYzBzRsEogf-Q,i9bTpU-XCg2BRJQxvHYM5A,z0rSmZQz9eEXjg_C3_E5-g,2,2013-09-12,"I love greek food and took my mom and aunt there, my mom has never had greek food. Decided on this place, because my favorite place (Ambrosia) closed and all the good reviews.
 
 Food was Ok. We had the dolmas (good) falafel (good) gyro (meh) and a combo with chicken (very dry) and Kofta (burned, dry and tasteless). The Israeli salad on the combo was very good.
 
 When we got our drinks, we noticed a slimy liquid at the bottom (overflow) of the soda machine. We hoped the top of the machine where the soda comes out was better.
 
 It was not awful but there are a lot more places to choose from.
 I will not go back.",1,1,0,0,1,0,1
2897068,q-3Dm_pbLhuxv_ulijZ-iA,VqsNH2mb_3x3UQCsvMO-JA,wEc4JE2NYQr1RnGjGr4q7w,2,2017-11-18,"The Rueben sandwich which I had today was pretty bad. The meat was salty, chewy and not layered on the bread. The bread was fresh, but the meat wasn't good deli meat at all. A neighboring table decided not to order it when they saw the sorry little sandwich. The onion strings were good. The TV's are nice, but they allow cigar smoking on the patio and that was truly obnoxious on this beautiful fall day.",0,0,0,0,1,0,1
1549010,ScCUli6q4R-Qevt8MyDvtw,u7dxmiH0hJvfkAwDMT5MgQ,9n8jDTvkOjoH3fD_Y9KC1g,2,2015-11-11,"This place was surprisingly bad. The place looks really nice. From the outside you expect this place to have good food. The menu should have been the first hint. Not a lot of options, and even still, not a lot of good options. 
 
 I ordered the grilled cheese and tomato bisque. It took 20 minutes to make. Plane white bread with little cheese in the center. The bisque tasted watered down. Overall it was very bland. Trust me, you will get better food from the place further down the terminal.",0,0,0,1,1,0,0
4057444,txxbUnfiiy0ffuZig4S3uA,tM3nQhfcm_j83MBDRc0Brg,fHM09_y3QX3n4a_bIFbk_w,4,2017-09-10,Visited for breakfast. Krysina A. was full of energy and extremely interactive. A plus when servers r usually robotic and task oriented. Loved her personality. Coffee was good and hot. Hash browns crispy. Bacon crispy. We ordered at the table.,0,0,0,1,0,0,0
984911,aYFC4LHt7nS6_5mWdt9pnw,YvHzoHUBsvSbVbzPdKkB1Q,R0SWtoj8DAAgrZ1ppm1zTA,2,2013-06-22,"I wanted to love this place, but didn't. I chose this place based on the online reviews, it did not live up to them at all. Perhaps the food here use to be good, and the cook lost her passion -I don't know, but I've had good Czech and Eastern European food and this was not it. 
 
 Having recently moved back to Ohio from San Francisco I was looking for a place like I use to go to in SF with my Czech Friend Martina called ""Frankies Bohemian Café"". http:\/\/frankiesbohemian.com\/. The owner came from the same town as my friend so whenever we went, we got the hook up-all kinds of wonderful Czech food not on the menu but made for ""family"". I've been missing it something fierce, now so looked online for something here in Cleveland.
 
 I came across Marta's and it had great reviews on a number of websites. I was looking forward to eating some really good\/stick to your ribs food. Unfortunately this place did not live up to any of the reviews. 
 
 The décor was totally vintage 60s and kind of charming. It had an European tavern feel with tables on one side and a long bar running the length of one side.The owner\/cook\/waitress was very pleasant but sadly that was the best part of the meal.
 
  We got there at 6 on a Friday evening and the place was completely empty. Having been open since 4pm and completely empty on a Friday night at 6pm isn't a good sign for any restaurant. We wanted pierogies for appetizer and were told they were out of the pierogies (potato\/cheese) we wanted. Strike 2-another bad sign for a business that clearly wasn't busy and running out of food. So we ordered the other filings and our entrees. 
 
 Anxiously awaiting our food, hubby got a Czech beer (on tap). Plus for having a good European beer! Then we got our food and it was mediocre at best-a total letdown. The plate was piled high with food, covered in pale looking gravies-not very appetizing. I got the Chicken paprikash and it was tasteless and bland. I don't know what the other reviewers got who raved about it but there was nothing to rave about with mine. The sauce was very runny, pale and bland. The spaetzel was good though. Hubby got Pork Wienerschnitzel-said it was tough, WAY too much breading and a greasy gravy. We couldn't finish it and declined any dessert. 
 
 Not only was it so-so, it was pricey. One appetizer, two entrees, one beer ($7.50 for tap beer!) and one Sprite came out to $42 before tip. YIKES! Not cheap and not worth the money. . If you want good Czech food, this is not the place to go. I will continue my search for GOOD Eastern European food.",3,2,0,1,1,0,1
1364674,rivUAglykHaBDE3jf_MLrQ,4U-dXR-gikJtr7tlZYIdvA,K5U3I0d4lHqzeMcUhgF1ZA,2,2008-10-09,"The dim sum here was pretty bad. But the service was surprisingly good. Dim sum houses are not normally known for their friendly waitstaff, but one of the push cart ladies here was quite attentive and promptly brought me things (chang fen, Chinese broccoli) when I asked.",0,1,0,1,0,0,0
3399768,_0YnPxjqJg3IiL7q5dvkDw,d53zKkkt335hxWbtvQCguQ,LkRSDF7gTNXg1OlNNBSVAA,2,2015-04-04,"For some reason, the tortellini was completely without flavour. This resto has long been a favourite of ours so we were stunned by the abject quality of what should be an effortless dish for an Italian restaurant. 
 
 We went in March, and our last visit was two years before that...so maybe something's changed. Please don't make it difficult for us to recommend you, Eduardo!",1,0,0,1,0,0,0
1855430,b9_3pnqyRaZpL91SD900UA,ODsM6-_BvHt6-cqNylJn7g,OAEeaLLm_9sHksKJEY0o0w,3,2015-10-04,"This location really isn't a dueling piano bar even though it advertises that it is. It's basically a bar where two dudes play the same song together and take requests and try to be funny. 
 
 Most of the audience here are over 50 so expect a lot of older songs and older people being drunk. The drinks are overpriced, but that's also expected. Still, the menu is really cool looking as I'm a huge fan of Napoleon. 
 
 Overall, it was nice to experience it once, but I wouldn't come here again.",6,8,7,0,1,0,0
5115318,v7JAOaBWWECPRFDr3ZirCQ,NIJWrUAz7-9IEqwZnGBT9g,XT3dn-9UsGhiEy-_ZU_M_Q,3,2016-04-06,"5 stars for the food..... about 2 for the service. On a Saturday afternoon during a Pens game there was 1 worker. The place was buzzing and the bar was full. I'm not shaming them for being busier than expected, but how servers handle busy times is important. A simple, ""Hi, I will be with you in just a second"" could have gone light years in the situation, but instead we were blatantly ignored and sitting at a dirty table for 15 minutes and finally approached without so much as a ""Hello"". I had to ask, after someone from the back cleared the previous guests' drinks and check, for the table to be wiped down.
 
 I ordered the cobb salad with smoked chicken and my mom ordered the pulled pork quesadillas. Both were very generous portions and tasted delicious. The menu here is extremely impressive and I don't doubt most everything else tastes as delicious as the food we had on Saturday. 
 
 It's a really cool industrial - barnyard décor and I think this restaurant would do great in Lawrenceville or Bloomfield if they cleaned up their service a little bit and had more people staffed for the Saturday lunch hour. This is off the beaten path with (from what I know) little signage. Probably hard to come across if you don't already know where to look. I don't get out this way very often but is definitely a place I would like to bring Bobby back to try. I'd be happy to give them another shot..but this particular experience left me wanting more in regards to service at at a restaurant. So, just A-OK for now.",2,0,1,1,1,0,0
1655664,d6fEdKybob5kVkZ_6EJ5pg,NFtPhYxsTaT-NDuPX1e9ZA,0PVxodALQu-soL5J8bjerQ,3,2013-12-12,"The food was good, slightly above average. I Ordered the steak and eggs and pancakes. The pancakes were slightly below I hop quality. I think they offer vegan and vegetarian food as well. Service was adequate but not over the top. I'd go back if I was in the area.",0,0,0,1,0,0,0
1518593,MlyMstHYttA93LobNJH0qQ,bU7j91DrMZCDrhPUrd_AWg,uSsTuB82xu2kgSUeNNKQcg,5,########,Place is clean staff are friendly and quick but most importantly they def make the best roti you can find in Toronto. We go once a month to satisfy our craving. If you like hear ask for pepper.,0,0,0,0,1,0,0
3671750,UDcGO7gG1gDm1sPjTl_SLA,uW7S5RrUW2WiqugdDvev5g,qTpQ75ewNY8jADWMuGkX-A,2,9/6/2017,"The only reason this isn't a 5 star rating is because of the crappy customer service I ALWAYS get here. I love dunkin coffee so I come here every other morning for some. However when my order is wrong, I'm treated with disrespect. No one takes accountability here! Not even the manager in the mornings! I'm sick of the mistreatment",1,0,0,1,0,0,0
351622,lfJBdVZAX9LUlssY4d63DA,Xks1q_BZi3hr5qyI7Bt7FQ,qdd1DHfeKHE72_djJxCJdQ,1,########,"Extremely frustrated, we like to go and enjoy their Happy Hour food but got turned away tonight because we had our grandchildren with us!!!!!! They told us Happy Hour is only for upstairs and you can't go upstairs with children. Last time we went with our grandchildren they honored Happy Hour downstairs due to having the kids...WE WILL NOT BE GOING BACK.",0,1,0,1,1,0,0
112373,wS3VVSWTwpg1GJMwvHVjhg,mu6xEHThck91bAyD38XuZQ,wFmPEuuW9loC9Kpecgudrw,3,########,"The Tron pub used to be a lovely bar when it was known as the Tron Ceilidh house, but since being taken over by the it's a scream chain it's gone a bit down hill.
 
 
  Decorated in garish primary colours, this place is primarily a student haunt. If you're a student you can buy a yellow card at the bar which gives you discounted drink prices, but even without it's fairly cheap. There's a tatty pool table, juke box and other machines, along with huge tv screens that seem to show every type of sport imaginable.
 
 
  The food is actually pretty good. Although it's mainly pub grub and stodge, it's cheap, there's plenty of it and it's great for a hangover. The Scream burger in particular is pretty fantastic.
 
 
  A decent enough place to pop into for a spot of lunch, but avoid on student nights or when there's a big sporting event on",0,0,0,1,0,0,0
1357358,YACGetIpwIoO3ESNDNIEYA,fOut10lknIp64tm3z6UTNg,Os1n1_idfw9vv9kwULGJnQ,2,1/3/2013,"This place has received plenty of positive reviews on YELP. I am not sure why. 
 I only came here for lunch because Ko-Mex was closed yesterday. From the outside, the place looks sketchy. However, I was pleasantly surprised at the clean and inviting dining area once we walked in the door. 
 
 For lunch, I chose the Moco-Loco which was layered with steamed rice, a hamburger patty, a fried egg, and brown gravy. I asked for my egg scrambled, not fried. Oh well - I ate it anyways. The dish was good--not great. 
 
 My wife tried the Korean noodle dish-Japchae. We didn't like the texture of the noodles they used for this dish. Imagine the texture of gummi bears while eating noodles. Because they were so spongy, no flavor stuck to them. Who wants to eat plain spongy noodles? Not this guy....
 
 My parents were with us since they were visiting from the Bay Area. They both chose the bibimbap (spelling?) which was a bowl of rice, vegetables, beef, an egg, and spices. The beef inside these bowls was bland, tough, and fatty. Oh, and the side of macaroni salad was way too salty.
 
 The service was spotty. For example, I didn't like that our entrees were coming out one at a time -every 5 minutes. Plus, I was not offered a drink refill at all during lunch. The more I write this review, the more I realize I don't really like anything about this place.",1,0,0,1,1,0,0
1992911,Fz9RLTUdaQ7Y55VVfWJeOA,_ec5jE9Wmdj2stjaU0NG0Q,rbcfYmJtqwIkk17IeOI5Kw,2,2/3/2016,"Ambience. Thumbs Up.
 
 Cocktails and Wine. Double Thumbs Up.
 
 Food? Overpriced Mediocrity. 
 
 I had Ribeye and Escargot. While the escargot was forgettable, I'm a steak man. 
 
 American Diner Steak? Excellent. Just make sure to throw an egg on it to add some taste.
 
 Pocket Burning Steak? Double Excellent. I love the monthly piece that lets me indulge in my carnivorous pleasures. 
 
 This was a pocket burning diner steak. $65, hacksaw rough, slightly overcooked, and literally 1\/3 fat. Not in between or around the edges fat, but literally an entire piece of the cut. Screw that mess.",1,0,0,1,1,0,0
