,review_id,user_id,business_id,stars,date,text,useful,funny,cool,contradictory,figurative,confusing,qualifier
1435277,rNHz_fPXDIo_AC5xRkdavQ,kXB_T2i7gyUYcMYxrGgC-w,QeFsIMcIFIJcOrpthYL8jg,2,########,"Amazing live music...they even managed to squeeze me in without reservation letting me know they would need my table after 9PM. i liked the hostess honesty. Great group of ladies.
 
 Unfortunately same cannot be said for server or food here necessarily. I was feeling a tender steak and made a point to ask the server which of their Bavette or strip loin is most tender. He told me the strip loin...so I trusted him. The person next to me was having steak frites...his looked perfectly cooked medium rare. I got my steak. Well done to hell. I told my server and he looked at my well done cross section and said ""yes you mentioned medium rare..."" Mind blowing stupidity. I said its over cooked and not medium rare....he says in Canada it's medium rare...I said if this is medium rare...what the hell is well done? Charred to shit?
 
 Anyways he claimed I should have ordered it blue and brought me a newer steak. It was better but not medium rare. More like medium. Steak was delicious but the vegetables were so\/so.
 
 I'd recommend the place for live music and OK food. Not great for perfect steaks. Prices reasonable but the food I would sort of say is below par.",0,0,0,1,1,0,0
4659908,U52QtTcRlUhO526A5IyXfg,CDmJmqXLHsizkG00aFuJ8A,SurnOSM2bVVN4-Js3G23RQ,4,7/2/2017,"Fantastic food! However, we were there for two and a half hours and only got two drinks from our waitress... with the cost of the food and the upscale type of restaurant it's suppose to be, I thought the service would have been better...",0,0,0,1,0,0,0
5252245,PQW0t7iEqRUGZHtaKtMtmg,eyGk7fNPNcQ2eorz10p5NA,wArcCMVnrl_tc9MULW-0CQ,2,########,"Was excited to try this place, but ended up pretty disappointed. Echoing what others have said, the beers do taste very watered down, so much so that we had a sip of each and that's it. Food wasn't memorable either, and 3\/4 of it came out lukewarm\/cool. The fish in the fried fish and tots was soggy and room temp. Overall, flavors weren't very good or special enough to warrant a return. It's also quite loud, I was really having to raise my voice to be heard by my dinner partner. It's a nice looking place for sure though.",2,0,0,1,0,0,1
2758552,3_g348Mi8_e95KDHzVp5Ng,#NAME?,NfwiVSw3wtfTzGrzbVZDEg,3,7/2/2017,"Service was good. The server was very professional and courteous. The restaurant just got slammed - high school grad ceremony across the street just got out. It's Kelsey's so you expect pub grub. Four of the five meals we ordered were good. Sadly, I ordered a steak. Chipotle shrimp sirloin. Don't order the steak!! Omg. Worst cut of sirloin ever. I mean ever. You know the tongue of an old pair of leather dress shoes that have been worn for years and years? It would have better texture than the cut I had. Gross. And naturally, the frozen veggies boiled to ""almost thawed"" were a nice touch. 
 At any rate, good spot for pub grub and a pint. Typical for chain restaurants I would think. I won't order big there again, but I'd order the fish and chips or the Mac and cheese. Oh, and don't ask for a special request...it will be forgotten...could have been due to the slam, or order entry done wrong....meh...",0,0,0,1,1,0,0
1669010,3pt1JSZYcTRhKeIo4uS5aQ,8fsZcLADFrPTbGrFqMACpg,V8wvvaOaRFqrjuPqVPuMjw,3,3/3/2015,"After a long day of shopping with the kids we had to stop at the food court for a potty break. While browsing at the after noon munchie options we decided to try this place Pita's which is also a Philly Cheese steak place as well. I did not know that one guy was running both outlets at first until I ordered at one and walked over to the other register and asked if I needed a cheese steak as well. 
 
 He was very helpful surprisingly. He made sure that I wanted everything I ordered. For example when we ordered the falafel he said ""you want the hummus, tahini, lettuce, tomato on the pita. most places will not explain what everything is like that. I am sure he did this because he probably gets a lot of people who order and are not really sure what they are getting seeing how this mall The Premium Outlets South is mostly for Las Vegas Tourists. By ensuring the order is correct when placed it puts the blame for mistakes on the customer instead of the business operator. Smart Guy!
 
 He did the same when I ordered the Cheese steak as well. He went through the ingredients including the cheese whiz like sauce that would be added to my sandwich. I also wanted lettuce, tomato, and mayo added and he repeated it back as well ensuring I was clear with what I was ordering. 
 
 The food came out at a decent time. They call out your number and you pick up the food at the other end of the Philly counter. The Pita sandwich was good, as well as the fallafel and hummus. They veggies were nice and fresh meaning the lettuce and tomatoes good bright colorful chunks. You could tell they were using fresh produce. My sandwich was a little small on the meat portion but it was delicious and fresh and made just the way I ordered it. I understand portion control consistency are important when operating a biz and meat is expensive. I am sure his rent at this place is Ridiculous!
 
 We finished our meal and our beverage so I went back to the counter to ask for a refill and he gladly took care of it. The guy even asked how my meal was tasting. Amazing! I thought the service we received was good. This man actually cared about our experience which is very important as a small business owner. This man get its. 
 
 The only reason I gave them 3 stars was becuase of the frumpy looking women sitting in a chair behind the counter. No smile, No hello, and no intention of doing either in the near future and on top ofit she was EATING! a wrap or sandwich right there in the food prep area in guest view. Not a care in the world. A big NO! NO! in my book. Everything else was good. Loose frumpy face....its killing your Biz my friend.",0,0,0,0,1,0,0
2991470,RikDg3CEdEfPRZFJ5zWgaA,IXSTfBSe56Z0RvYg4Cfn2w,ST66dWiUqYnvrD7zT4QBNw,5,########,One of my favorite lunch spots. Green Chile is very good. New Mexico style. The green Chile burrito with beans is cheese is how I like it. Red isn't bad either. Chimis are delicious. Love the shredded beef tacos. But if you just feel like beans....get a bean and cheese burro. Omg the beans are so delicious. Home made just like they are supposed to be. Beware you will get very sleepy after eating. Not good if you are working after a good lunch here.,1,0,0,0,1,0,0
558493,dr1GnUDsYMxAj5e76STJ0A,OEcTMOFRUNBpQAsVySbgVA,sIKuBMvUCqqjN0uqI70btA,4,########,"This place is good for one dish and one dish only, so do not order anything else.
 
 The chunked beef noodle in soup is their specialty and what a good dish it is! My husband and I (especially by husband) really like this style of noodle and have tried many places throughout all of Toronto. This is by far one of the best places to have it. The beef is cooked to just the right tenderness even though it is we'll done. The noodle is thick and have the right amount of texture to compliment the beef. The best of all is the soup base. It is a flavorful and rich beef broth with some spiciness added to it that enhances the taste rather than overpower it. 
 
 During lunch a free cup of Hong Kong style milk tea is served for free. While not the best (that honor goes to marathon cafe at midland\/finch) it is slightly above average. The tea is not too dark and goes down smooth as it should.
 
 Like any other Chinese restaurant in the world, the priority is places on quality and price, not service. You come for food, not a chat with the staff. They are friendly but temper your expectations.",0,0,0,0,1,0,0
4154669,fdEkR7BoUYPOex7Y-4sQCA,HmYj8wXXzzmc80DIenufuw,T4g4k2OhCTsiqcP-ZXElHQ,3,6/4/2013,"Would I come back here? Hmm. Maybe not because I haven't tried The Loving Hut across from it which I hear has rave reviews (I'm eating vegan as much as possible these days).
 
 Maybe, if I wasn't eating vegan\/vegetarian that day and will cheat to eat a steak tartare (although I can just make it myself it's not that hard).
 
 I took a quiche and a tarte, and both were okay.
 
 FRENCH ONION SOUP
 The deconstructed french onion soup seemed a bit greasy (can see the oil on top), and was SO flavourful that when I went to go eat the quiche, I needed salt. A lot of it.
 
 I also wasn't a fan of the croutons soaked in there (I usually avoid croutons in a French Onion soup, as I just want the onions...!), but I did like eating a whole whack of mozzarella cheese melted at the bottom.
 
 Just found it rather greasy in general, or oily-looking.
 
 QUICHE
 The quiche itself was good and WAY better than at Patachou near Summerhill station (now THAT is an embarrassing place to eat because they pretend to know how to make a quiche but really have no idea it tastes like tofu for dogs).
 
 The only downside to the quiche for me was that I took the vegetarian option but the leeks made it all mushy. WIth leek quiches you absolutely need to eat them hot and freshly made, otherwise it just tastes odd. You're better off eating the ham quiche than a leek one that isn't fresh out of the oven. Just a tip from me to you.
 
 TARTE
 The tarte was also good but odd. I was somehow expecting something creamier and more like a firmer creme brulee but with fruit on top, and this one tasted more like the filling was ground almonds with blueberries. Still delicious, but it was rather tough (the crust was) and hard to finish due to my struggling with a fork.
 
 Is this the best French place to eat in Toronto? No. Go to Didier by St. Clair if you want to try better French bistro fare at lunch.
 
 Does this make decent desserts to eat? I've only had the tarte which wasn't so bad, but I still prefer Nadege by Ossington \/ Queen for pastries.
 
 Is this a decent place to eat if you're in the area, starving and with no other choices around as far as you can see? Yes.",1,1,0,0,1,0,0
3343313,SGWOQWwX3hGGIMc407hc8Q,jwKsSS7Rl5gvWfnc7XmMaA,SZEFE5hL7aN5nM-A44iPwQ,3,########,"I never though that I could not enjoy a big bunk of lobster. But I guess it's possible. This place was just really pretentious without anything to back it up. Granted, we were a big group of 20-somethings but the place was pretty empty so I don't think a bad attitude was warranted. 
 
 I think the theme of the night was quantity over quality. The shellfish platter was full of giant pieces of seafood that tasted like it came out of a freezer\/buffet line. The lobster was really rubbery and flavorless, but it was cute that they de-shelled it in front of you. Perhaps I should have gotten steak at a steakhouse (who knew?) The creamed spinach and mashed potatoes were good, but nothing memorable. The creme brulee was really good (isn't it always) and the chocolate volvano souffle was also good. 
 
 But i don't think anything would compel me to come back here. Even the deco is stuffy and pretentious. Boys, come here in a suit.",1,0,0,1,1,0,1
2156739,XVzPKdD56kHHh4emsmmbMg,KXSzTO-bi6_Fcysm0mEHpg,5shgJB7a-2_gdnzc0gsOtg,4,########,"i had:
 
 tomato bread, sliders, fries, babyback ribs, and ham&cheese croquette!
 
 they were amazing! gave me instant coma though,
 fast and attentive service too!",1,0,0,1,1,0,0
1176365,iQGnuc_YHk2XQLXtMHqn0g,JhkJvHl_ySzXBuH7ceFOEw,uxM2hXYkS9kr-DiQN2lB5g,1,########,"First to the good points: the atmosphere and the service were good. 
 Now, to the OK points: the music choices were OK but way too loud.
 But to the main point: while the food is creative and tasty, in no way is this a restaurant for dinner. Each dish\/portion is the size of a tapas plate, but priced at a full entree\/mains level. This is precious, self-indulgent food, all about showing off the executive chef's culinary whims and not at all about serving a clientele with any appetite.
 Perhaps we might not have minded had we been on an expense account, or had drunk so much that we no longer noticed, but we left feeling we had been taken advantage of. This restaurant is all about the chef, and not about the diner. We didn't patronize it to be trendy, we went there to eat. And not at such an expensive price point.
 And as someone who's lived and eaten all over the US, I sure didn't recognize any of the Southern US cuisines supposedly riffed upon here....",0,0,0,1,0,0,0
3291214,FITcmN9dcH0vwErJQTquZw,Uux8Ycj4Z0vxI2FaQ8ih7A,jc4Wlgme6xI0-c1U_AKuBQ,5,########,"All food here is amazing! My favorite is the ""evil jingle"". I get it extra spicy. This means I will have exiting issues later, but it is totally worth it.. The staff here are very nice and on top of things. I love their accent. Love the environment here. Best Thai I have ever had!",0,0,0,1,1,0,0
731553,0Wshet7rHJidwoN3dhHOZQ,LIkkgyWBCR56VJEu5_YI-Q,iqQEH6olFhpqwZjFRRFmuA,4,6/6/2013,"Pretty good sushi. Always fresh tasting, never been sick, and they have some tasty rolls. The only downfall that I find is that many of the rolls are similar and that they use a lot of sauce on top. I always ask for half sauce. Also, I would really like to see more sashimi OR rolls without rice (like a cucumber wrap).",0,0,0,0,0,0,0
4017179,JjfBXl38v1PS298fmo1CIQ,#NAME?,VxRlBe2wjtycFWSZm1orTA,5,########,"Caveat: I'm not a huge fan of Irish pubs. Irish pub food is generally uninteresting to me, and the food usually looks like dull glop on a plate. Not so at Piper's Pub. I went for Sunday brunch ~2pm, and the place wasn't at most half full. They have a great beer selection with a rotating list of good micros, & a special Sunday menu. 
 
 We went for Scotch eggs & the Smoked Salmon Boxty. The eggs took some time but my guess is that they were prepared fresh. They were good...but I wasn't blown away. Nothing against Pipers, I just don't think they're my style. Interesting though. 
 
 The Salmon Boxty...it was amazing. When I go back, I'll likely get the same thing...unlike me, but too delicious to pass up. It's more than filling so don't order anything besides an appetizer, or you'll feel like a fat kid. Think of it as a potato\/egg omelette...or just look it up on wikipedia for better description. Seriously though, get it. Your life may be changed forever.
 
 Also make sure to follow them on Twitter; they always announce their daily specials & newest beers on tap.",0,1,0,1,0,0,1
2077248,QbjIa92NMC7xfuQZkJfDSA,oQxGYo6ROSnsBMPAb1T9bQ,xfWdUmrz2ha3rcigyITV0g,3,########,"First the burger WAS GREAT! Can't argue that. But after all it is a $15 burger, it had better be, lol. The reason for the 3 star rating was the way they pile up extra charges without letting you know. After my kids ordered their plain ole hamburgers the witness asked if they wanted mushroom or bacon. They, being kids said, ""ok"".......They don't tell you that that added $16 to the bill by doing that. Actually they way she mentioned it I too assumed it was part of the meal, she never said that it was extra, but then again I live in Vegas and know how they underhandedly gouge visitors. Shameful. Gordon, you don't need the money that bad.",0,0,0,1,1,0,0
3494574,RZtlPBcINh3UsrF4QbMwRA,ImShCMuA27t4LXnTUz4Bnw,rbcfYmJtqwIkk17IeOI5Kw,5,########,"I have NO business going to a French restaurant. I request everything sans beurre, sans frommage, sans lait, since my curse developed in later-life is to be unable to tolerate dairy (thank goodness it struck after an indulgent honeymoon eating through France.) However, my dear friend wanted to enjoy a French meal, so we wondered into Bardot Brasserie. First, I must say that the service was SUPERB, and to me, service is a make or break aspect to a meal. The waiter and wine attendant were both fun, knowledgable, informative, and just lovely. Although the chef had every right to be un petit perturbed with a no-butter diner, he and the waiter conferred to decide what could be best modified for me, after I preemptively declined the salad nicoise. Chacuterie plate with bread--yum! Blue crab buckwheat crepe sans butter--good, not great-- although I did sneak a pinch of sauce on top. Beet salad with arugula so good-fresh and nutty arugula with hazelnuts to accent the nutty flavor, went perfectly with the goat cheese (I had to have a bite of the cheese). My friend was practically cooing with pleasure from her escargot wrapped in pastry; she said it was smooth and buttery goodness. The suggested wine was a pleasant surprise. I'm not a white gal (well, white wine, that is), but completely enjoyed the nectar-y German Kabinett. Finishing sorbets--orange and mango--so fresh and clean and more fruit-filled than just icy. Great espresso. Overall, a wonderful, indulgent lunch and I look forward to going back soon. SO, if this dairy-free gal can enjoy it so much, I imagine how good it is for those who are unencumbered. 5 stars for my enjoyment at Bardot Brassiere. And, I never would have known it was the 3rd day open--kudos to Bardot Brasserie!",2,2,1,1,1,0,0
4026544,OILwOtsHeFZKf3O3UZ6HNQ,VK5wB63rEMb5Hp-9OCPs1g,FL_UG4G1btvH5K3TVDvnew,4,########,"So this was my second time coming to dine in, but I've bought bagels from them multiple times. They advertise a breakfast deal for 4.95$ comprised of 2 eggs any style, a bagel or toast and a small coffee or tea. The first time I came here, I ordered just that and it was fine.
 
 Today, I decided to try out their omelette. I ordered the omelette with onions and cheddar cheese, roasted potatoes for an additional 0.50$ (have the option of a salad or sweet potatoes), a bagel and a tea to go. It all came to about 14$. Everything smelled really great and I was really looking forward to having a nice and filling breakfast. 
 
 As usual, their bagel was delicious - I have nothing to say about that. However, when it came to the eggs and roasted potatoes, there was waaaaaay too much oil. My mom tried one piece of the potatoes and wouldn't finish it, since she found it too oily. I was really hungry and ate about half of the omelette and the potatoes. Boy do I regret that. I don't think I tasted much of the cheese, but there was a hefty amount of onions (which I appreciate). Right before writing this review I had to take some tums. In retrospect, I should have probably either stuck to their plain eggs or ordered an egg white omelette (big maybe though). Either way, I would never order the potatoes again. 
 
 I will most definitely come back for their bagels, as they are absolutely delicious. But, I would order their omelettes with caution or not at all.
 
 ----------------------------------
 This is an update review..
 
 I have to say that their bagels are indeed delicious. I come back almost on a weekly basis to get bagels or their sandwiches (cravings!!). Their borekas are also yummy, whenever they have any left.
 
 I still don't think that I would order their omelettes anytime soon, but I'm definitely a returning customer for some of their other products. Their customer services is also very good, as they always welcome me with a smile and are very kind to their customers.",1,0,1,1,0,0,0
2282401,Q3we8TU3ewkzq9PjqbxCOw,ztHEYlV5KLnfmmPpj6w49A,6MhY_9EkUkKCvvN8rzXZzg,3,########,"um. not great. i ordered the chicken lo mein and the crab puffs - and well, was a bit bored. the decor is shady. and to be perfectly honest, if i'm going to eat chinese it should taste good - greasy and with a ridiculous calorie count but good.",3,1,1,1,0,0,1
131514,ECExOqEFXTlXXzlQhoBF5g,aRrTlgks-2SXqCsUtQSXjw,UCpUOtvqR-NBWBNVMzJleA,3,2/4/2013,"This place used to be great. Its gone kinda down hill. Maybe I would have given it a four star but the disappointment of how good it used to be takes another star :). The food is no so so where it used to be so flavorful. The service has gone down to, it used to be young energetic waitresses. Now they look like retired hooker that don't want to be bothered.",1,0,0,1,1,0,0
4547717,znXN_Bkqp78OSrWhwLu6fw,gzio8J3Xdn-cs02VX_61Sg,_fwWavAVMwH5u9K0K-PoQg,3,########,"Went here during lunch with a few coworkers. Place was very quiet at 12:30PM on a weekday. No need to wait. Solid service. Nice clean environment. 
 
 Now the food. The Funions are really good. Get um to share. Now for the mac and cheese. You get a lot of saucy cheese, topped with more stretchy cheese. I got the drunken cowboy, which had 3 slices of beef brisket with BBQ sauce. I'd recommend something with a tangy sauce like the BBQ to balance out the richness of the cheese, cause there's A LOT of cheese. It was nice to have something cut that grease coating in your mouth after each cheesy bite. I personally would like the cheese to be a touch saltier. The pasta was a little on the overcooked side. It was quite pricey for what you're getting IMO. Granted, it's definitely a heavy meal and you will leave full as hell and ready for an afternoon nap.",0,0,0,1,0,0,0
2543753,#NAME?,_jbmhophmP36tnUPulJBog,QQIwwU1tyOyKwr_sgqfYmw,2,########,Very disappointed. The restaurant is beautifully decorated and relaxing. Nice looking bar and enough tables to be cozy but not crowded. But the service was on the slow to absent side. The food was mediocre. The sides were good but the entree itself was lacking for both my companion and me. Boring fish and dry burger. They were willing to make swaps and substitutions on the menu which was nice. I had a nice glass of wine--I'm glad I didn't want another because it was never offered. I wanted this to be a great little restaurant in the area and I'm disappointed it's not.,0,0,0,1,0,0,0
1247799,BmKyaCaBZu2lV5b-tQ2LlA,h3SfoZcs04WnJErnFaeBpQ,UsKmYp0m8VYWM96tkGm2vQ,3,########,"Opted for African Palace because Nazareth was good. Great little spot. Service was a little on the slow side but rightfully so as there was only a single waitress for an otherwise full house.
 
 Admittedly, I haven't had too much Ethiopian food. I had the meat platter and the flavours were great, particularly the goat. I could eat a whole plate of the goat, actually. Great for a vegetarian. The spreads aren't overly saucy so they won't completely sog the already spongy injera. It's also relatively cheap. $20 for 2? Why not.
 
 I'd return when the craving strikes again.",1,0,1,1,1,0,0
2499279,il3DUNLZVkGASEW50vw43w,D8iGf2Sf9NrNw62wptur5A,sQFpfRs1Flcw3evCdI2wpA,4,########,Good location! The food is okay. The servers are great and helpful. Ordered chicken noodle soup. It came with a small bowl.,0,0,1,1,0,0,0
2249799,9I0_ntfrqZKKQ2mE5uOk2g,YDAL4CBJcp3xrYgAGVGgaQ,jo4nS-avhKux4IFwFCsrvw,2,########,Had the special with chicken and the chicken was very low quality. The sause was nothing too special either. Had it for dinner and it tasted like it was there all day.,2,0,0,1,1,0,0
4788200,2ak3-Sb8xAJkglC7aptzsw,jC3XHk3oxqayr0Ti5_B29Q,SHFlELFcEcAOJv_fTAKChQ,3,########,"We are visiting from out-of-state and decided to dine here for dinner since this place had good reviews and our hotel was only a few blocks away. When we arrived, the hostess brought us to a table upstairs even though the lively brightly lit bottom floor was mostly empty. The upstairs is VERY DIM that we had to use our cell phone flashlights just to read the menu! TIP: If possible, you may want to request a seat downstairs instead.
 
 We ordered (in order of our favorites): 
 
 1. Patatas Bravas (surprisingly sooo good!)
 2. Prosciutto Crostinis (our 2nd favorite with a good mix of sweet & salty) 
 3. Cherry Glazed Lamb Lollipops (these were good but a bit too raw for us so we asked for them to be cooked a little longer and then they came out perfect) 
 4. Market Mac & Cheese (our least favorite; kind of bland)
 
 Good, friendly service. Will be back again.",0,0,0,0,1,0,0
2368797,JQ2NGU8rxiNC_DT5FEFrZw,OK4UMl-UzQILKm-ZTrfSIA,2PkCvqcVZUmPndaqsyWqdw,3,########,"This place is good and deserves a 3.5 stars but not quite enough to push it to 4 stars. The gyro was very big and tasty but was pretty plain. Contained meat, onion, tomato, and sauce. If you're looking for a quick tasty lunch, go here but i wouldn't say you should plan ahead to go here. Worth a try but not something i would go to on a daily basis.",0,0,0,0,1,0,0
4089544,KOulpFRZ130jZe-pQgJ80Q,8c_TbIqpeW1z0itSgVnKyA,Wmk_NNEJ6KOR9w7QM7oisA,3,########,"First time here. First hamburger in Canada since we arrived a few days ago. And our verdict:
 
 1. Pricey. Paid Canadian $ 12.71 about ($10 US) for a quarter pounder with American cheese, regular fries, and Dasani bottled water. 
 
 2. Burger came out quick...likely it was pre-cooked.
 3 out 5 stars.
 
 3. Fries came out a but greasy but with a good crisp.
 
 4. Service was great
 
 Overall, Five guys beats this place with both hands tied together.",0,0,0,0,1,0,0
